{
  "schema": "dokion.playbooks-lock.v1",
  "revision": 1,
  "generated_at": "2026-08-01T07:15:00Z",
  "dokion_version": "0.3.0",
  "packages": [
    {
      "package_id": "dokion-labs/secure-web-app",
      "version": "1.2.3",
      "source": {
        "name": "example-registry",
        "id": "example.registry",
        "transport": "git",
        "location": "https://github.com/example/registry.git",
        "immutable_revision": "1111111111111111111111111111111111111111"
      },
      "registry_index_digest": "sha256:aaaaaaaaaaaaaaaaaaaaaaaaaaaaaaaaaaaaaaaaaaaaaaaaaaaaaaaaaaaaaaaa",
      "manifest_digest": "sha256:bbbbbbbbbbbbbbbbbbbbbbbbbbbbbbbbbbbbbbbbbbbbbbbbbbbbbbbbbbbbbbbb",
      "artifact_digest": "sha256:cccccccccccccccccccccccccccccccccccccccccccccccccccccccccccccccc",
      "files": [
        {
          "path": "playbook.json",
          "digest": "sha256:eeeeeeeeeeeeeeeeeeeeeeeeeeeeeeeeeeeeeeeeeeeeeeeeeeeeeeeeeeeeeeee",
          "size": 4096
        }
      ],
      "provenance_state": {
        "integrity": "MATCH",
        "immutable_source": "PINNED",
        "publisher_identity": "UNPROVEN",
        "signature": "ABSENT",
        "freshness": "CURRENT",
        "revocation": "CLEAR"
      },
      "compatibility_state": "COMPATIBLE",
      "installed_at": "2026-08-01T07:10:00Z",
      "installed_by_dokion_version": "0.3.0",
      "lifecycle_state": "installed_inert"
    }
  ],
  "authority": {
    "selection_authority": false,
    "substitution_authority": false,
    "installation_authority": false,
    "activation_authority": false,
    "execution_authority": false
  }
}
